subtopic_name,question_text,explanation,answer_1,is_correct_1,answer_2,is_correct_2,answer_3,is_correct_3,answer_4,is_correct_4,answer_5,is_correct_5
History and Examination,"You are replacing an old intra‑oral unit that still uses E‑speed film. Best receptor strategy?","Fastest suitable receptor (F‑speed or digital) plus rectangular collimation optimises dose without losing diagnostic yield.",Retain E‑speed film—no benefit switching,FALSE,Switch to D‑speed for sharper images,FALSE,Upgrade to F‑speed or digital sensors with rectangular collimation,TRUE,Use slow film to ensure exposure accuracy,FALSE,Use panoramic imaging instead of intra‑oral films for all caries exams,FALSE
History and Examination,"Practice is purchasing a new intra‑oral X‑ray set. Which specification most improves dose efficiency and image consistency?","Constant potential DC/high‑frequency units produce a stable beam with lower skin dose and improved contrast.",Single‑pulse self‑rectified AC 50 Hz unit,FALSE,Constant potential (high‑frequency) DC generator,TRUE,Hand‑held unshielded AC unit without backscatter shield,FALSE,Any unit—generator type has no effect on dose,FALSE,Low kVp (<50) to eliminate scatter entirely,FALSE
History and Examination,"A patient with a severe gag reflex cannot tolerate the standard holder for a maxillary molar periapical. Best approach?","Bisecting angle is an accepted secondary technique when paralleling is impractical; avoid unnecessary panoramic exposure or finger-in-beam.",Abandon image acquisition entirely,FALSE,Use bisecting angle technique as a justified exception,TRUE,Use patient’s finger to hold the film routinely,FALSE,Take a panoramic instead purely for that tooth’s apex detail,FALSE,Increase exposure to compensate for non‑standard geometry,FALSE
History and Examination,"Two periapicals are taken for a supernumerary canine; tube shifted mesially on the second film and the impacted tooth image moves mesially. Interpretation?","SLOB rule: Same movement = Lingual/Palatal; Opposite = Buccal.",Tooth is buccal (opposite movement),FALSE,Tooth is lingual/palatal (same direction),TRUE,Movement is random—repeat films,FALSE,Indicates internal resorption,FALSE,Indicates external resorption,FALSE
History and Examination,"A low caries‑risk asymptomatic adult new patient requests a “scan to check everything.” Optimal response?","IRMER requires clinical justification; panoramic not indicated solely by request; bitewings depend on caries risk.",Take DPT—patient request justifies exposure,FALSE,Decline DPT; no indication—use clinical exam and risk‑based bitewings if needed,TRUE,Take DPT plus full mouth periapicals to be thorough,FALSE,Take DPT instead of bitewings for proximal caries,FALSE,Take DPT annually for baseline monitoring,FALSE
History and Examination,"A colleague uses lead aprons and thyroid collars for every adult intra‑oral radiograph. Correct advice?","Routine aprons/collars generally unnecessary; optimisation achieved via selection criteria, collimation, receptor speed; collars can obstruct panoramic positioning.",Continue—mandatory for all exposures,FALSE,Remove both—modern optimisation (collimation, DC units) makes routine aprons unnecessary,TRUE,Replace with full body shield,FALSE,Use apron only if pregnant to block ovarian dose from intra‑oral beam,FALSE,Use thyroid collar for all panoramic radiographs,FALSE
History and Examination,"A 30‑year‑old has painless intermittent single clicks, full opening, no locking. She requests MRI “to be sure.” Best action?","Asymptomatic clicking without dysfunction does not justify imaging.",Order MRI,FALSE,Order arthrography,FALSE,Reassure and decline imaging,TRUE,Order CBCT for soft tissue disc evaluation,FALSE,Order PET‑CT,FALSE
History and Examination,"Which scenario most appropriately justifies a limited FOV CBCT?","CBCT is indicated when 2D imaging is insufficient for a specific high‑risk anatomical relationship (e.g. nerve proximity).",Routine annual review of stable implants,FALSE,Primary proximal caries detection in a teenager,FALSE,Complex mandibular 2nd molar impaction near IAC where 2D views inconclusive,TRUE,All new orthodontic patients,FALSE,Screening for periodontal disease in low‑risk adult,FALSE
History and Examination,"First‑line imaging for suspected submandibular duct sialolithiasis causing meal‑time swelling?","Ultrasound is first‑line for salivary obstruction; sialography now adjunct.",Conventional contrast sialography,FALSE,Ultrasound,TRUE,PET‑CT,FALSE,Arthrography,FALSE,Panoramic alone always sufficient,FALSE
History and Examination,"Trainee states PET “detects beta particles emitted directly from FDG.” Correct clarification?","PET detects coincident gamma photons produced by positron annihilation.",True—beta particles hit detectors,FALSE,False—detectors record paired 511 keV annihilation photons,TRUE,PET detects only alpha particles,FALSE,PET detects Compton electrons directly,FALSE,PET uses ultrasound, not ionising radiation,FALSE
History and Examination,"After switching to digital sensors, retake rate rises because “dose is low.” Why problematic?","Dose advantage of digital depends on minimising retakes—unnecessary repeats increase patient exposure.",Digital images lack legal status,FALSE,Retakes negate intended dose reduction and increase cumulative exposure,TRUE,Retakes improve contrast inherently,FALSE,Retakes are excluded from DRL audits,FALSE,Film processing errors justify higher retake rate,FALSE
History and Examination,"Essential element of a dental radiography QA programme?","QA requires systematic reject audits and benchmarking against diagnostic reference levels with documented reporting.",Eliminating all rejects entirely,FALSE,Recording exposures only when abnormal,FALSE,Regular reject analysis and comparison with DRLs,TRUE,Storing images without reports to save time,FALSE,Allowing personal, unreviewed exposure charts,FALSE
History and "Which endodontic scenario justifies CBCT?","CBCT is appropriate when complex anatomy affects retreatment decision after inconclusive 2D imaging.",Initial diagnosis of simple single‑canal incisor pulpitis,FALSE,Routine assessment after every root canal,FALSE,Suspected untreated MB2 canal in maxillary molar where 2D views inconclusive and retreatment planned,TRUE,Screening for caries pre‑orthodontics,FALSE,Annual recall of asymptomatic apicectomised tooth,FALSE
History and Examination,"Tube shifted distally; impacted mandibular premolar image moves mesially. Location?","Opposite movement relative to tube shift indicates buccal position (SLOB principle).",Buccal,TRUE,Lingual,FALSE,Palatal,FALSE,Within mandibular canal,FALSE,Indeterminate,FALSE
History and Examination,"Post‑chemoradiotherapy head & neck cancer patient shows equivocal soft tissue thickening clinically. Best imaging to assess metabolic activity?","PET‑CT evaluates metabolic activity to differentiate residual/recurrent malignancy from post‑treatment changes.",Routine bitewings,FALSE,Ultrasound with Doppler only,FALSE,PET‑CT,TRUE,Conventional sialography,FALSE,Cephalometric radiograph,FALSE